author,updated_at,like_count,text,public
@bharataadeez136,2024-05-24T06:43:31Z,0,Boringggggggggggggg,True
@ansamantha7307,2024-05-09T09:54:45Z,0,"Everything in this film was fantastic, at some point i felt I was watching a documentary, everyone was so real! And Sandra should get all the acting awards known to man for this!",True
@amandabertolaso7917,2024-04-26T23:59:02Z,0,What a load of bollox...,True
@rizkarinaangrenani2566,2024-04-24T02:05:44Z,0,"Just watched this movie! It was so great and very well done, I needed to decompress my mind.",True
@Jegscerteza,2024-04-22T14:59:56Z,0,Film language in English?,True
@renada432,2024-04-20T02:23:15Z,0,"Maybe she did not kill him , but I believe she made him kill himself",True
@TomRipley7350,2024-04-14T19:49:45Z,0,The biggest mystery about this film is how anyone could listen to that PIMP song for pleasure.,True
@GodwinBaxter,2024-04-13T15:18:52Z,0,One of my favorite movies of last year.,True
@alexandergrant4702,2024-04-11T07:09:45Z,0,The worst music (noise) in cinema history. Inexplicable really. Stopped watching on eleven minutes.,True
@AdventureTime101,2024-04-10T22:48:08Z,0,pile of shit dont bother watching,True
@axsstudio6407,2024-04-07T01:55:15Z,0,Boo. 0 stars. Great acting but a disappointing ending. A whodunnit that doesn’t reveal whodunnit. WTF people?,True
@jasonsharpe7419,2024-04-07T01:49:43Z,0,Boo. Great acting but disappointing ending. A whodunnit that doesn’t reveal whodunnit,True
@jasonsharpe7419,2024-04-07T01:49:08Z,0,Boo. Great acting but disappointing ending. A whodunnit that doesn’t reveal whodunnit,True
@mohankumar-is6co,2024-04-04T08:59:05Z,0,Extraordinary trailer  ❤❤,True
@Thepomafame,2024-04-01T22:31:01Z,0,"Let’s be honest, every single girl is thirsty for Swann Arlaud, the actor who plays the lawyer, thanks for this movie so we got to know this brilliant actor.",True
@qwargy,2024-03-31T03:58:52Z,0,I was tricked into watching this. By the time it ended I felt like I’d wasted 2 and a half hours of my life. Total shite!,True
@srilankabest1287,2024-03-28T21:41:10Z,0,I told my friends that this is a very interesting movie. At last they left our house joking that our precious time was wasted and scolding everyone who made the film.😑,True
@e.oliveirasouza4669,2024-03-26T01:05:50Z,1,Boring,True
@marvinomarmenjivaralvarez2086,2024-03-25T13:01:13Z,0,What a year for Sandra Huller! Impressive performance and such a good film.,True
@Kelly-rs8ut,2024-03-25T02:03:19Z,0,What a waste of time.,True
@randywhite3947,2024-03-24T12:41:52Z,0,8:41 am march 24th 2024,True
@randywhite3947,2024-03-24T12:41:23Z,0,I’m about to watch this movie for the first time,True
@wallace7858,2024-03-23T22:07:12Z,0,guys is the movie good should i watch it,True
@RN-pg3ns,2024-03-21T15:21:37Z,0,Is this dubbed or are they actually speaking English? I’m confused 😅,True
@miralemhusanovic2992,2024-03-20T22:34:38Z,1,Fuj - dont waste your time ! -1/10,True
@sawdahello8352,2024-03-20T18:14:40Z,1,This film really made me think about our relationship with language,True
@markan032,2024-03-18T21:14:55Z,0,"Има занимљиву причу што се тиче судског процеса, као и психологије личности.",True
@C1oaked,2024-03-16T14:26:31Z,1,1:25 Adept?,True
@gavriela509,2024-03-16T14:21:30Z,0,So... She did it or not?,True
@_what._.,2024-03-16T00:39:49Z,1,Such a masterpiece!! Congratulations to Justine Triet for this well-deserved Oscar !! 👏👏❤️,True
@yabrgon,2024-03-13T21:55:27Z,5,THANKS for the trailer i just watched the whole movie.,True
@keepgoing7533,2024-03-13T18:00:50Z,0,"I'm at the point where the wife and the lawyer are having a drink after the hearing outside her house at night, and
I think he's a daschund/head.",True
@applemayteves,2024-03-13T13:32:52Z,0,I like to watch this but I don't know where. huhu,True
@MrRemyguy,2024-03-13T04:02:50Z,48,"that ""Stop! I did not kill him. ... That is not the point."" is why i went for this movie. Loved it.",True
@lorettanericcio-bohlman567,2024-03-13T02:47:10Z,0,I thought Sandra Hüller was Carey Mulligan 😳,True
@qrcadia,2024-03-12T18:48:47Z,0,My God this trailer is absolutely wonderful. Brilliant editing.,True
@simarsingh2935,2024-03-12T11:31:01Z,2,Here after Dog stole the show at Oscar.,True
@DrishyakavyaKannada-bc6ci,2024-03-12T10:38:49Z,0,Huge crowd to watch the movie at BENGALURU INTERNATIONAL FILM FESTIVAL-2024 (INDIA),True
@seilrang,2024-03-12T08:46:43Z,0,I came here to the dog. But...,True
@jordanmyers487,2024-03-12T03:38:34Z,0,Meh…. trailer looks decent. Can’t give it 5 Stars like everyone else. But I’ll give it a watch and see if my opinion changes.,True
@abdelkhalik.aljuneidi,2024-03-12T00:15:14Z,0,Masterpiece,True
@kvllingray.1885,2024-03-11T19:26:44Z,14,"Every single performance in this movie is Oscar worthy... Sandra, the judge, the little boy, even the dog",True
@kingslyroche,2024-03-11T18:08:03Z,1,Here for Messi.❤🐶,True
@lafa13337,2024-03-11T16:32:21Z,0,boring,True
@silvinacarnavale466,2024-03-11T16:19:15Z,1,Messi❤,True
@Ingrid0410,2024-03-11T15:37:11Z,0,Just watched this yesterday superb acting!! But I was left at the end after her son was taking her side and comforting her at the end that she probably was guilty. What do you think? Remember when Marge said yv gotta pick a side? To Daniel?,True
@sswmbe1841,2024-03-11T12:18:17Z,0,What a 👎🏻👎🏻👎🏻,True
@PoetlaureateNFDL,2024-03-11T02:04:36Z,0,Good trailer 😊,True
@azadymiad1793,2024-03-11T01:22:47Z,1,A24 is trash,True
@moviesbye9294,2024-03-11T00:53:54Z,0,Another A24 snorefest.,True
@savaryas,2024-03-10T02:35:30Z,0,I think the boy did it he’s blind and still managed to go up there like if he did before and even the dog felt scared of him when he gave him aspirin,True
@erkazzofficiel,2024-03-09T23:17:11Z,0,available on amazon prime,True
@djbpresents9584,2024-03-09T15:52:48Z,0,How to watch,True
@boxer_puncher,2024-03-09T11:20:24Z,2,"Oh what a f.cking bore! Always the same sh.t with these fake intellectuals: Life imitating art, no, art imitating life, constipated artist in depression with suicidal tendencies, high intellectual marital conflicts, not being able to express one simple fu.king thing with 100 words, endless bla bla... I can't take it anymore, I swear to God, I can't. Please, I'm begging you: If you can't pull your sh.t together and make a decent movie, just don't! And if you happen to have made one, show it to your fuc.ing boring circle of fake intellectual friends  in Paris in your fuc.ing favorite boring super duper elite café and leave it there. Ohhhh God...I need one from the Coen Bros now to get going again, that's my medicine!",True
@m.a.6738,2024-03-08T20:37:41Z,0,The movie is sexist. The woman is clearly the victim here,True
@arefriendsaseptic,2024-03-08T19:28:11Z,1,This film didn't need to last two and a half hours. It's an interesting premise but it drawns out and becomes tedious.,True
@constans4,2024-03-08T08:06:29Z,0,"You know what? I think the director and or writer of this film may have been influenced by the Depp-Heard trial the year before, especially concerning the audios. Oh no, Heard wasn't the monster who admitted to committing domestic violence, that was JD hitting and throwing things at himself",True
@TurboGauchiste,2024-03-08T02:01:00Z,1,Don't trick yourself this movie has more than half of his dialogue in french be aware,True
@jox667,2024-03-07T23:46:53Z,25,It makes no sense that the little kid is not nominated for an Oscar.,True
@TheLifestylerSum,2024-03-07T22:05:05Z,0,"Brilliant actors, great movie",True
@maritgirl1,2024-03-07T05:06:12Z,0,"This trailer is fantastic, although it tricks you into thinking it's a classic courtroom drama / suspense film but it isnt that at all. But I like the deceit because it means more people will see this great film. 😅❤",True
@dawidekpieron3859,2024-03-02T05:43:32Z,3,"dog's performance in this movie is just OUTSTANDING 😮😮 There should be a price for animal performance in a movie ànd Snoop would definitely won this one ... really
..it was phenomenal😮",True
@yusufalam3899,2024-02-28T14:54:39Z,0,"I can't tolerate it, it was my worse scene trailer ever.",True
@tusharp399,2024-02-28T12:46:00Z,3,"🌸Amazing how his Wife is a Potential Killer, Cheats in Marriage, Robs his Story for Novel, Flirts with Girls, Physically & mentally abuses him, still the Audience is expected to treat her as a Victim. Sad state of Oscars where movies of such Horrible ideology get Awards💩",True
@tannerhuskins330,2024-02-27T17:15:02Z,4,Fantastic movie! Not sure about marketing it as a thriller though. It’s not,True
@alihunter25,2024-02-27T13:04:35Z,0,"Woah la bande annonce est folle, bien joué pour ça Néon",True
@danielvmay,2024-02-26T22:23:03Z,2,oh because he falls....i get it.,True
@bog335,2024-02-26T22:10:37Z,2,50 cent is the best in this film,True
@lukenarlee8118,2024-02-26T16:59:27Z,1,"Yes, this movie is good, but not nearly as intense/riveting as the this trailer makes it appear to be.",True
@farihajafri6317,2024-02-24T23:55:02Z,0,She needs to get oscar ..please please.,True
@darnellwilliams9917,2024-02-23T13:27:29Z,0,"If you’re looking for a great emotional drama, good job to the cast the arguments during this movie felt so valid. 👏🏽 brilliant bravo",True
@leandrodiaz851,2024-02-22T06:18:09Z,0,"This looks exactly like ""A cry in the dark"" film.",True
@Dalwhinnie15,2024-02-21T20:43:50Z,0,Looks good.,True
@omchoudhary3422,2024-02-21T13:30:22Z,0,After Dr gaurav Garg recommendation😅,True
@leonardopetric3362,2024-02-20T21:18:37Z,1,"Quite boring movie, OVERLONG!!!",True
@bjj21,2024-02-20T06:58:51Z,1,"This movie was absolutely boring. If you want to watch a trial about no murder go for it. They had no murder weapon, no cause for alarm other then an argument, no plot twists, nothing. No sadness, no acting, just plain boring. Go watch a real murder trial",True
@alg54,2024-02-20T01:04:07Z,0,I'm here because Bill Burr said this was an awesome movie.,True
@alexaaa87,2024-02-19T08:27:56Z,1,"Thats what happens, when a face is not full of botox, etc...! The story can be delivered way better! <3",True
@skyhawk8267,2024-02-18T13:32:18Z,0,Am I the only one who saw Matthew Modine as the Anatomy of a Fall corpse in the autopsy room?,True
@thetimsalaproject,2024-02-16T11:37:49Z,2,Dont know anything about this movie but tell me about the dog? Is he a good boy?,True
@ba8501,2024-02-16T01:44:10Z,0,I love films like this. I will definitely have to watch it.,True
@redindian8344,2024-02-15T18:03:41Z,3,"My guess points :
1. The mother is guilty
2. The child lied at the beginning during the reenactment to protect his mother (he changed his mind)
3. he lied again at the end of the trial, my perspective is seeing the director's way of conveying it with the way the father speaks in his son's voice, making it look like a lie being voiced by his son
4. maybe with the long trial process, he thought that rather than losing both of his parents, he chose to lie (as his guard said: it's better to decide by speaking as if it were true)
5. At the end of the film, the child kisses his mother as if the child is protecting his mother and his mother thanks him without saying it, because his mother seems to have a high ego when listening to the recording (with the flashback)",True
@redindian8344,2024-02-15T17:56:08Z,5,"Like most courtroom dramas there are loads of extended flashbacks here, and while the film runs long, the exceptional lead performance from Sandra Huller holds it together. 👌",True
@TheM1988z,2024-02-15T09:41:17Z,1,"Definitely great acting performance and story I was captivating by it about 4 days , but the magic of it faded after that the only thing touched me is Sandra performance",True
@cicerodiello1,2024-02-12T01:13:36Z,1,"The French Alps are magnificent.  It could have been a masterpiece with Hitchcock at the helm.  Instead, it seems that the creators stood around a cauldron abs threw whatever happened to be laying around into the brew.   Ambiguous French films that ask you to create the plot.  Snoop is a legend.  Woof!",True
@elainegmorrison,2024-02-11T23:47:32Z,3,"Good movie. It held your interest. Interesting how they turn everything into a clue while you don't know where it points to. The characterization is the real essence of the movie, with the mother as the cold egotistical father, the father as the self-appointed woe is me mother, the lawyer as the amorous unrequited suitor shmuck, and the kid as just plain creepy. Nobody else got that vibe? And while everyone was focused on the mother whom they did not particularly like, or the father who obviously was tired thanklessly giving to this world, nobody was looking at the blind kid who could do just about anything and eventually poisoned his dog.
The mother made the world revolve around her, also regarding her partner's death. Selfish, cold, unwavering. When she ceased being the centre of attention she felt the let down of her court victory. The father did need a change to what he had set up, but he was also full of excuses and self pity for his lack of professional action. Violent, manipulative, passive aggressive. If he is a writer, why is he drowning the household with loud music? There was a court appointed guardian, and I don't have a real opinion about her. She saved the dog, assisted in barring the mother from her own home, abandoned the kid quite a bit for the guardian of a blind boy. The only likeable character was the dog. And as with all black sheep, he was duly punished for his noble babysitter duties by being overdosed by his charge. I can't forget the exhausted look of the herder barely managing to walk behind the son, then leaving him to eventually place himself in bed with the mother instead. The father is dead. The mother was on trial. The lawyer and babysitter go home alone, and the dog made his choice where it was safe to rest. I think we all know by this time there was more to the poisoning/suicide story than what the characters had said. It's not what you say. We're watching what you do.",True
@user-dn4po4fy9e,2024-02-11T21:04:00Z,93,"In my erudite opinion, the coveted Oscar for Best Actor ought to be bestowed upon the illustrious canine, Snoop, from the cinematic masterpiece ""Anatomy of a Fall."" Having viewed the film recently, I found Snoop's performance to be remarkably natural and professional. Even amidst the dire circumstances of ingesting a plethora of aspirin, his portrayal remained authentic, a testament to his consummate skill. I ardently propose his nomination, as his depiction undeniably elevated the film to the realm of true artistic brilliance.",True
@Michael-wx4sb,2024-02-09T16:20:02Z,1,"This movie was so boring, all that trouble for an ending that was what it should have been.",True
@TomO-nx1bd,2024-02-08T05:15:05Z,4,"Luckily I saw the trailer after seeing the movie.  Anybody who hasn't seen the movie, I recommend not watching the trailer it kind of would have spoiled some of the surprises for me.",True
@chka5324,2024-02-07T04:00:41Z,5,Please please please give her the Oscar ❤ It would be such a joy!,True
@lolcopexx,2024-02-06T06:54:32Z,6,Much better than any American Hollywood trash put together,True
@danielcooper4455,2024-02-04T20:40:17Z,1,Here cause of Louis CK,True
@perro_muerto,2024-02-04T17:44:14Z,0,ass,True
@p.dkarunathilaka2054,2024-02-04T16:28:29Z,1,Boring,True
@psyskeptic9979,2024-02-04T13:49:09Z,3,This trailer gives too many clues away. As do many modern trailers,True
@A.Montefalco1485,2024-02-04T10:53:56Z,80,"This is hands down one of those movies that are worth to watch if you like mystery/thriller. This movie has an intense feel to it in a different level. No intense music, no jumpscare, no fear to induce. But it was wild for me.",True
@gracetaylor4429,2024-02-03T05:11:24Z,3,She’s going to win best actress,True
@bruh_hahaha,2024-02-02T18:38:49Z,5,Best film of the year.  It deserves all its’ flowers.   🍿🏆,True
@GalletaGalletosa,2024-02-02T16:05:04Z,7,"A perfect film, everything is done so superb, i was floored",True
@lazyneha,2024-02-02T15:43:45Z,1,where can I watch  this movie,True
@pooder53,2024-02-02T01:39:03Z,2,"Wild stab in the dark here, but after watching this trailer, I think the twist is her husband had decided to kill himself and wanted to do it in a way that frames his wife as a murderer. Am I close?",True
@HOOD-421,2024-02-01T17:33:37Z,0,Ehh looks mid feels predictable 😂 bet he got sick of the bitch an offed his self ..... Super dark times or super 8.... Thats what this trailer feels like they wanted to accomplish but they gave too much  away 🤷🏽‍♂️,True
@justawatcherofpeople,2024-02-01T12:14:42Z,2,I freaking love this movie.,True
@Carolina-bw6gy,2024-01-31T20:07:42Z,0,PERFEITO,True
@shyx746,2024-01-30T09:35:13Z,0,"I have been really looking forward to this movie for a couple of months. It is finally released tomorrow in Korea 
But I am worried if it is boring.
I want to ask people who have watched this about it was nice in the most parts of this.",True
@user-bj9yg4hy5o,2024-01-30T06:06:20Z,0,"I am very excited to watch this film, when It releases in the cinemas of India during February 2nd 2024, looks very Interesting. 
This film will be my 2nd film in the cinemas after Anyone but you.",True
@aurelie-annegilly8018,2024-01-28T15:40:25Z,5,such a good film. So many layers.so much thought. And so thought-provoking.,True
@elcasualmx,2024-01-28T00:02:50Z,0,She did It,True
@Darren_Tay,2024-01-27T09:00:44Z,0,This is not a whoddunit film. This is more like drama with elements of thriller.,True
@ZStrelok,2024-01-27T05:01:16Z,6,"My favorite film this year following Oppie. Gripping, enticing and masterful storytelling.",True
@sabrinademario8934,2024-01-26T19:21:43Z,3,Best Picture. Best Actress.,True
@s.leochapman417,2024-01-25T15:44:32Z,46,Absolutely superb film. Stayed with me for weeks after seeing it.,True
@sunwicee,2024-01-24T21:20:40Z,1,one of the best movies I've seen,True
@cyclewisecaitlin,2024-01-24T19:11:42Z,1,How gorey/violent is this? It looks awesome but I don't do well with graphic stuff.,True
@rgrgrgr13rg,2024-01-24T12:29:22Z,0,Far out this looks so good,True
@madhurikaverma578,2024-01-24T10:14:41Z,0,"Simply Amazing Movie, Watched This in Film Festival And Absolutely Loved IT!",True
@pythgoreansassistant2789,2024-01-24T03:16:26Z,2,"Saw this movie. It's okay. I think people are overstating the drama. It's more of a courtroom film. Besides the obvious question of what actually happened, this film kind of overstays its welcome in length.",True
@stefandee1970,2024-01-24T00:26:46Z,3,Boring,True
@agihiruda,2024-01-23T20:13:13Z,0,If Rorochan had her biopic filmed:,True
@Suzu52,2024-01-23T16:37:40Z,5,Where can I watch this- especially since it is now nominated for an Oscar,True
@kennyg64,2024-01-23T16:01:29Z,0,Kind of reminds me of an episode of Bob's Burgers.,True
@anthonybenvenutto-tg9bx,2024-01-23T14:42:26Z,2,ACADEMY AWARD NOMINEE SANDRA HULLER,True
@Dbzlatino27,2024-01-23T07:55:11Z,0,"I dont know if will be an spoiler or not (its seems to be an SPOILER heheh so you have been warned before reading more if you havent watche dthe movie yet) but one thing i notice was how from the beginning the boy is learning to play a piece on the piano and gradually as improve on it also does on lying trying to cover his mother the mere story  he told to the jury on the end when we hear the father speaking with the voice of the child i feel was just an invention that he made after not knowing in what to believe on the end he had to take an decision after talking with marge in comparison as when we hear the audio of the mother and father discussing not only we see the whole actual moment but also the voices respectively of each one.
 He also change his opinion very early on the movie when he said he was inside the house instead under the window outside, there were many reasons why i feel the  mother actually is guilty though as you see on the move  nothing is completely clear and leave you with you own interpretation of what truly was what happened  on that moment although in my opinion even with all that i still hold that based on the context that happened and  some clues kinda make me certain that was guilty ,",True
@vickycowhey4031,2024-01-22T16:38:05Z,402,When I first saw this trailer I thought it was a documentary on a true story.  The acting is phenomenal.  Wow is all I can think to say.,True
@TonkaUpsidedown,2024-01-21T20:03:46Z,3,Gurrrl that movie is like an hour too long. Watched it on 1.25 speed and it still bore me to death. Maybe im not so intellectually superior and just think this movie is avarage,True
@lilgoku7018,2024-01-21T06:43:29Z,0,Is that the guy From the Butttercream Gang?,True
@CoffeeStainer,2024-01-19T02:40:59Z,1,Too many movies about the mental destruction that relationships have on men. The line between information and entertainment is getting blurred and I hope people are beginning to learn. Especially men.,True
@Loveisall23,2024-01-17T00:18:24Z,2,The movie Staircase vibes,True
@curtisnewton895,2024-01-17T00:08:30Z,2,"yet another ""I did not kill"" bullshit movie",True
@fidker,2024-01-16T21:48:51Z,1,"Finally it's coming to my theaters, going to watch it tomorrow",True
@hughgrection5674,2024-01-16T17:50:36Z,3,"One of my films of last year, the performances and tension are a filmmaking masterclass 👍",True
@blsof8bc,2024-01-15T22:24:03Z,2,"An absolute fail, total abomination.",True
@user-fp4pu6vh5b,2024-01-13T23:26:32Z,6,Just finished watching. Masterpiece.,True
@vidropartido,2024-01-13T10:25:55Z,0,I've seen this movie. The kid pushed him.,True
@amritagill1680,2024-01-13T05:11:14Z,56,"Such an amazing movie. Really, this film is about handling pain - how we perceive our loved ones handle it, how we handle it... it is also about expectations and dreams. Very layered and nuanced. Amazing performance, script etc.",True
@shuriken05,2024-01-13T02:24:50Z,1,"Gonna call it now before I seen it, The son did it.",True
@jehvty1143,2024-01-11T00:54:24Z,3,"Damn, the US trailer is really good and breathtaking ! Miles away from the french trailer that is also good but much less tense, more theatrical.",True
@MBArkestra,2024-01-09T13:51:59Z,0,"Good movie, but too damn long",True
@najeebsiddiqui6796,2024-01-08T03:59:14Z,0,What was the song her husband was listening?,True
@munchies1533,2024-01-08T02:16:48Z,21,"Congratulations on winning Best Foreign Language Film, Best Screenplay on the Golden Globes!!!🎉🎉🎉🎉🎉",True
@ivankoev9379,2024-01-07T23:21:42Z,2,i think Antoine Reinartz played superb in this movie. Of course Sandra Huller was outstanding. It will be between her and Emma Stone for the Oscar this year,True
@jeffriesmovies,2024-01-07T14:44:16Z,0,"the end of this trailer is annoying, not everything has to smash you in the face repeatedly with a hammer",True
@imbored1573,2024-01-05T18:43:32Z,0,"Best non English language film, golden globes?",True
@hanifnahian,2024-01-02T22:47:58Z,0,Binod,True
@JackHandelman,2024-01-01T21:50:34Z,0,Just watched this; great movie but i bet american audiences won't enjoy the ending :(,True
@theshah9756,2023-12-29T10:59:51Z,1424,Even the dog's acting is pure masterclass. Woof!,True
@eddydraconian,2023-12-29T10:30:09Z,3,After watching the movie I think she killed her husband.,True
@Mos41f,2023-12-25T22:13:45Z,10,"IMO, Sandra really did kill Samuel and her kid didnt want to lose another parent. End of.",True
@suestewart4884,2023-12-21T21:58:56Z,3,"I came across this by accident at my local cinema The Showroom Sheffield. Definitely one to see again, even though it's a whodunnit and you know the conclusion. And THAT music! Best film I've seen in years.",True
@GreenteaFaerie,2023-12-20T01:09:29Z,0,It was really good,True
@chooselife3750,2023-12-18T20:30:54Z,0,Anybody else only clicked on this because of that one fanfiction,True
@RockAddicted7,2023-12-18T11:15:20Z,250,"Best movie of the year. I watched it for the first time yesterday and loved it. I was on the edge of the seat until the end. The writing and the acting are superb. The film has so many layers, it makes you reflect and question your own life. Masterpiece.",True
@rcculture6613,2023-12-17T19:50:04Z,1,"BORED, ... FAKE SCRIPT",True
@ElioPerlman17,2023-12-17T05:58:30Z,21,The Dog should win Best Supporting Actor,True
@sdufg,2023-12-17T02:37:13Z,1,spoiler; the dog did it.,True
@pauldunkley760,2023-12-15T21:15:41Z,28,"One of my favourite films of the year, hands down.",True
@whydoimevenhere,2023-12-15T08:16:57Z,0,the snow is the alibi.,True
@bobbybeltran6142,2023-12-15T05:56:57Z,23,Saw it last month. Definitely one of 2023's best films. Sandra is always pitch-perfect especially given her complex character.,True
@kikiwilliams29,2023-12-15T00:37:27Z,1,It's giving A 21st Century Hitchcock directed movie & I'm all here for it. I cannot wait 😌,True
@ahmedsalim6112,2023-12-13T08:47:47Z,0,this trailer is very misleading but the movie is far more better than this trailer!!,True
@Stefarooh,2023-12-12T12:12:47Z,529,Quite possibly the greatest court room drama ever committed to film. Sandra Hüller takes your breath away. She is definitely getting Oscar nominated for this role. In fact she deserves to win.,True
@jorditorro6273,2023-12-11T22:58:52Z,982,"Sandra’s performance is sheer art. The intention of the film is to confuse you or doubt who did it or what happened and she portrays that with such ease. One minute you think: “OMG look at her, she’s 100% guilty” and a minute later you think: “OMG look at her, poor her, it’s impossible” and all that with just one look.",True
@mohofojo8129,2023-12-11T18:43:46Z,204,"At some point I even suspected the dog, this movie is incredible",True
@Astutindocumentat,2023-12-11T11:55:23Z,2,And what's the point?,True
@loveyourself1803,2023-12-08T17:43:05Z,1,Slow but good film,True
