author,updated_at,like_count,text,public
@daviroman1198,2023-12-06T04:39:49Z,2,Its giving Tar on Ice,True
@jonzelstein1682,2023-12-04T02:12:55Z,0,Nice try,True
@rufarojunior,2023-12-02T12:52:38Z,0,This movie is awesome,True
@willcollins3421,2023-11-28T06:39:05Z,1,one of the most deceptive trailers ive ever seen,True
@digrom3279,2023-11-26T14:10:20Z,0,Is this out online/streaming?,True
@garrisondinsmore5808,2023-11-23T11:41:15Z,0,where can i watch this?,True
@jgfg,2023-11-19T08:17:10Z,0,Why is this in english? I thought its a french film. Was this dubbed?,True
@mackielunkey2205,2023-11-19T07:44:51Z,3,The best French movie with 50 Cent and Snoop Dogg references.,True
@kristi.s9922,2023-11-19T00:04:37Z,5,There was a clue about weather she did it or not. And I loved it. Something about how strong someone is. Maybe I imagined it. Great movie.,True
@joewas2225,2023-11-15T17:59:36Z,1,This is a copy & paste of Decision to Leave story wise. But completely different execution. Plus looking online & reviews it's not revealed if she's innocent or guilty.,True
@brendanlittle2498,2023-11-15T11:56:10Z,0,Really good movie,True
@jacobmartinez5461,2023-11-12T23:02:42Z,3,I fell asleep. Boring movie,True
@cadburydragon8469,2023-11-12T13:22:19Z,1,I want so bad to discuss the entire thing but ill get reported for the spoilers lol all ill say is the music told its own story and this was some of the most convincing acting ive ever seen,True
@sandycowell1288,2023-11-12T00:48:39Z,79,Saw this yesterday - 24 hours later we are still debating did she/didn’t she…MAGNIFICENT,True
@thisme2911,2023-11-11T17:12:08Z,8,I don't have time to spend two hours figuring out why he jumped out of the window. I've got bigger problems to worry about in my life.,True
@jacobmartinez5461,2023-11-10T17:18:20Z,0,Is this any good,True
@gutterbaby8382,2023-11-10T04:42:57Z,69,"This should be nominated for Best Picture, Best Director, Best Original Screenplay, Best Actress, Best Supporting Actor and Best Editing. And it should win a few of them.",True
@marronetavares.,2023-11-08T13:33:30Z,6,"I need to watch this, right NOW!",True
@renen5315,2023-11-07T22:48:40Z,0,"Why doesn't have subtitles in English, instead of the ridiculous accent?  
Trump killed him.",True
@emiliobello2538,2023-11-06T19:20:27Z,0,Preview might have appeared on many movies at AMC,True
@mainmanmainlining7575,2023-11-03T21:43:26Z,273,I practically held my breath for the entire film. Riveting. Maybe best court room drama of all time because you don’t notice it.,True
@brissa2840,2023-10-30T06:10:47Z,1,Everyone go watch this,True
@jasonsandoval680,2023-10-28T23:54:15Z,1,I don’t know what you heard about me…🎶,True
@wallykaspars9700,2023-10-27T22:00:20Z,0,Is this an American movie?,True
@kristinaketelsen5797,2023-10-27T15:24:35Z,0,Why is this movie in English?,True
@Padidas85,2023-10-26T04:55:48Z,43,One of the best performances I have ever seen.,True
@robertoinzunzamorales1844,2023-10-22T19:35:16Z,6,"I did not hit her is not true is bullshit i did nooooot, o hi mark",True
@SVD978,2023-10-22T15:06:46Z,2,I'm unsure on this one. It looks like a generic did the wife do it sort of film,True
@onil1325ms,2023-10-20T21:49:21Z,2,"Incredible film, but the moments with Snoop toward the end were tough to watch. I wanted to punch the kid for even trying something like that on a dog. I KNOW ITS FICTION AND THAT ITS A FILM - don’t fuck me in the comments.",True
@A1CLGroup,2023-10-17T01:01:26Z,4,Shoutout to 50 Cent!,True
@redox.cinema,2023-10-11T15:57:12Z,0,got to see this at NYFF this past weekend. It was incredible!,True
@FilipeFela,2023-10-03T19:15:53Z,0,"O YouTube está dando apoiler do filme, ao por o anuncio: se vc quiser se.matar, ligue para numero tal""",True
@alterrush5930,2023-09-30T18:47:30Z,18,Anatomy of a trailer cause I’ll be damned if there was a trailer as good this in recent times,True
@bedbug02,2023-09-22T16:11:13Z,0,I cant wait for this 😢,True
@Somelikeitthrift,2023-09-22T00:46:13Z,6,Imagine he fell that way to frame her,True
@shunyata7488,2023-09-12T04:25:41Z,1,"this is the kind of movie that's called real monstrous. but, what's make this more terrifying is the SUICIDE helpline in the description.",True
@moeezS,2023-09-03T14:43:54Z,5,"Loved Sandra Huller in Toni Erdmann, can't wait for this. Excellent tense trailer.",True
@MB-rh2ew,2023-08-24T17:24:48Z,1,The trailer took my breath away.,True
@ashleylodewyk7454,2023-08-21T13:31:58Z,15,This movie looks better than what I'd imagined a movie winning the Palm D'Or.,True
@gabrielcastaneda9700,2023-08-19T09:07:27Z,61,Sandra is definitely getting an Oscar nom,True
@user-sl8nq2ix3h,2023-08-18T23:24:55Z,11,"This trailer is quite misleading ! It’s an interesting film, but prep yourselves for something much slower and contemplative. :)",True
@chadstchad,2023-08-18T19:00:41Z,375,"damn, this looks good. also a perfect example of why we don’t need to keep making movies and tv shows about ACTUAL monsters whose names deserve to be forgotten, just make a fictional story as if it’s based on real events.",True
@Rafylt,2023-08-18T18:30:37Z,1,Amazing!!!,True
@aaronjanlistanco,2023-08-17T23:43:58Z,6,"my Oscars 2024 predictions for Anatomy Of A Fall are

the sure:

Picture
Actress (Sandra Hüller)
International Feature

the maybes:

Director (Justine Triet)
Supporting Actor (Milo Machado Graner)
Film Editing
Cinematography",True
@anacruz2077,2023-08-17T22:01:25Z,2,this won the palme d'Or so i hope it’s good,True
@sengkitlee-en1es,2023-08-17T20:39:13Z,0,haunted deer squad trailer trailer 2024 October 31,True
@SA-xv3kv,2023-08-17T20:09:58Z,1,,True
@thenerdster_,2023-08-17T20:09:54Z,0,👏👏,True
@johnny-vu6rl,2023-08-17T19:22:25Z,1,looks ok. lead actress ruins it though.,True
@prayashmudi1999,2023-08-17T19:12:45Z,0,OMG,True
@drewmcgill5290,2023-08-17T19:04:40Z,97,You know a movie is going to be lit when you get a national Suicide hotline in the header before watching 😂,True
@moonshinebling,2023-08-17T18:11:31Z,4,Was waiting for this trailer.looks good!!!,True
@CharlieMeier,2023-08-17T18:09:58Z,332,Crazy how different this trailer makes the film look and feel compared to the original trailer released a month ago. Super excited either way!,True
@Fabian-hg1mw,2023-08-17T18:05:58Z,0,yawn,True
@Borderlnd,2023-08-17T18:04:57Z,1,Looks Awesome,True
@Borderlnd,2023-08-17T18:04:49Z,0,HOLY SHIT!!!!,True
@perfectionbox,2023-08-17T17:57:15Z,4,she trashed his videogame collection and he killed himself out of despair,True
@Sharpe1502,2023-08-17T17:31:52Z,7,"Neon   🤝    A24
Making and distributing
       good movies",True
@NonFatMead,2023-08-17T17:29:49Z,1,The son did it,True
@Jodzy504,2023-08-17T17:26:47Z,0,Intriguing!,True
@EnoVarma,2023-08-17T17:22:53Z,0,Why is this in English?,True
@SFreije1,2023-08-17T17:09:40Z,14,So excited for this!,True
@SuperMassman,2023-08-17T17:08:53Z,1,"☝️😏are you reading these comments: there pure crap. Instant masterpiece? Instant watch?.. who are these people? .. let's see if this movie is actually worth a watch, before we rush to the rah, rah",True
@75akatsuki75,2023-08-17T17:06:45Z,0,what's the release date tho,True
@mr.sushi2221,2023-08-17T16:43:16Z,45,I’m glad the topic of spousal abuse is now entering a more mainstream cinema and not just pure art film,True
@7DAYS_ATSEA,2023-08-17T16:42:31Z,4,What's with the dog panting?,True
@princessmovie8523,2023-08-17T16:39:58Z,52,looks incredible!! probably going to be the best of the year ❤,True
@DebbieSanna,2023-08-17T16:37:09Z,7,Decision to leave (2022),True
@jeyneo.8924,2023-08-17T16:35:47Z,24,I hope this is really a Masterpiece,True
@betheneytroyer1156,2023-08-17T16:34:17Z,2,I can’t wait to watch this,True
@samya1231,2023-08-17T16:32:43Z,20,Looks damn interesting! Gonna catch it if it arrives in theatres here in India,True
@rorschachs1889,2023-08-17T16:13:06Z,5,Release date where ? Anyone,True
@Chuuzus,2023-08-17T16:11:57Z,1582,"If no one got me, I know Neon and A24 got me",True
@bilalaftab2546,2023-08-17T16:10:10Z,9,release it already,True
@sapphicfilmnerd,2023-08-17T16:04:02Z,2,Slay,True
@suresh201862,2023-08-17T16:03:12Z,1,❤,True
@that0n3guymobile58,2023-08-17T16:01:28Z,20,Neon movie = Instant watch,True
