author,updated_at,like_count,text,public
@Dezil,2024-05-29T23:52:45Z,0,Happy A24 is trying to redeem itself after their propaganda film,True
@rocco...,2024-05-29T22:05:04Z,0,Whoever produced this movie should quit while they're behind. Such a lacklustre effort on such a deep subject. Pretty paltry!,True
@blackterarsblood,2024-05-28T06:34:17Z,0,Sad,True
@TheJoraful,2024-05-27T17:20:56Z,0,Hah. Like jews near the Gaza...,True
@tienglongmy,2024-05-27T14:58:26Z,0,So sick of these people and their constant propaganda.,True
@satoaji,2024-05-26T15:42:01Z,0,Beautiful way of shooting that hides the screen like the masters of old Japanese movies,True
@iceysuhn5503,2024-05-20T23:49:13Z,0,"This movie honestly didn’t need a dialogue. The entire time, the background was doing the storytelling. Bravo.",True
@hakanyilmaz4076,2024-05-16T07:32:07Z,0,"very bad trailer, could be better, i see just one side of him life, in the trailer",True
@hannah9281,2024-05-15T14:32:52Z,0,Can't wait to watch,True
@HoldinContempt,2024-05-14T22:36:15Z,1,"Oh look, poorly filmed, artistically bankrupt atrocity propaganda, Designed to make you forget about the fact that jewish supremacists are ethnically cleansing Palestinians right now in the current year. A24 is literally the Canon Films of our generation and they are making shameless b-movie schlock of similar quality style.",True
@m19petersen,2024-05-14T03:22:08Z,0,00:40 looks like a furnace. Absolutely incredible shot.,True
@user-cj8yr5tq3m,2024-05-13T23:27:06Z,0,"סרט דפוק ומשעמם אכזבה ענקית , הסרט הזה זכה בפרס אוסקר חשבתי שאני הולך לראות משהו מיוחד כנראה שמי שנתן לו פרס היה שיכור או מסומם",True
@davecollins1753,2024-05-13T08:17:34Z,2,Hypocrisy at its finest right now innit,True
@leonmart6719,2024-05-12T11:46:50Z,4,"The film portrays very well what the Zionists are doing with Gaza and Palestinian families.
Zionist Genocide.",True
@highway_to_haven,2024-05-12T09:21:19Z,4,"A film about the same thing that the Nazi state of Israel is doing to the Palestinians in 2024.  The same brutality, the same cruelty.",True
@crescentmoon54,2024-05-12T02:46:50Z,1,Haunting movie... especially seeing it at the end... I walked those same places and have never gotten over it....,True
@ryanburns6284,2024-05-10T22:43:39Z,0,Just about to watch this ….,True
@jimday666,2024-05-10T21:13:24Z,1,Movie was sh!t AF. Don't waste your time. Brilliant my @$$.,True
@amishkeger244,2024-05-07T19:59:38Z,0,If you had to sum up what this movie is about what would you say?,True
@EarthSoulsAstrology,2024-05-06T17:21:07Z,0,Love what the BBC said in the first quote considering that they push their communist agenda on the British public everyday 😂,True
@pavingo,2024-05-05T14:23:49Z,0,Worst movie i have ever seen a movie but strange start a movie with strange ending there is no content in the movie don't waste your time of almost 2 hours on this movie,True
@user-vn7lc5en3c,2024-05-04T14:14:07Z,0,Never saw a movie that was so hard to watch. It is also a movie we need to watch. After this no one will ever forget it.,True
@jannikszymanski4912,2024-05-04T13:46:25Z,0,Der Trailer ist grausam. Welcher Hund hat das denn geschnitten??,True
@davidrhodes7325,2024-05-03T21:25:26Z,0,Not enough diversity and representation for me 😐,True
@Moshenegad,2024-05-03T13:37:51Z,4,"The film defends the Jews in a stupid way. In my opinion, this film is made by the Israel lobby in America",True
@Maximillion666,2024-04-30T04:38:08Z,1,I've watchwatched half of the movies so far and it's one of the most haunting movie I've seen in decades.,True
@HoneyHoops-ig9ws,2024-04-29T22:13:56Z,10,and now those victims have been doing the same to the gazans for decades,True
@The_Rock_That_Floats,2024-04-28T23:48:34Z,6,"These are the scariest farts, with applied reverb, I’ve ever heard..",True
@marinamarthiensen8548,2024-04-28T10:21:30Z,1,Worum geht's?,True
@vishalanthony1529,2024-04-28T03:39:46Z,0,This was more of a review lookup of the critics.,True
@JackJohnson-kl8el,2024-04-28T01:32:19Z,0,Unimpressed…just like with the previous 3 a24 movies,True
@like9614,2024-04-26T17:34:06Z,2,잼있으려나 ㅋㅋ,True
@gardengnome2409,2024-04-26T14:02:02Z,0,Great film. Loved the start of the film. The Camp Comandant taking a horse to work. What a way to commute.,True
@miket9732,2024-04-26T05:42:05Z,2,This movie flat out sucked… what a waste of time,True
@amartinjoe,2024-04-25T21:58:10Z,0,"I avoided any holocaust movies - since it's the ""once you've seen one, you've seen them all' routine - until this one came and I was blown away. The filmmakers brilliantly crafted this masterpiece -  it didn't show any gore - just the sounds - the lead actors were fantastic + the minor details in the narrative (the father towing his 2 kids on a canoe in the river) is such a brilliant  metaphor for Nazis who committed such grave crimes but spared their families from seeing the horror. Amazing amazing movie. The ending is something that will stay with me forever - I've never been to Auschwitz - but those last scenes hit me like a brick wall. Jesus.",True
@riocss3178,2024-04-25T01:24:45Z,0,"Esos planos se ven muy artísticos ❤️, me inspiran a hacer películas",True
@ny0128,2024-04-22T01:21:21Z,0,what a trailer...definitely watch it,True
@4atlanta4,2024-04-21T16:33:22Z,1,This movie sucks,True
@genidoagnelli8409,2024-04-20T16:18:59Z,3,"It doesn't seem to be much different from today's situation near the Gaza Strip, where on one side people are enjoying their swimming pools, and on the other Genocide is in action. 😪",True
@user-on1vi3xu8n,2024-04-20T11:29:14Z,0,Kakva ironija,True
@michaelgreen5749,2024-04-20T08:54:56Z,0,The art sublime,True
@esthermej,2024-04-19T17:52:04Z,0,does anybody know this song?,True
@46metube,2024-04-19T12:12:15Z,1,For all its good intention it failed to create that palpable abstract horror.,True
@arazduhoki225,2024-04-18T21:59:38Z,1,This movie was so different than every ww2 related movies I've seen..I mean the natural soundtrack made me feel more into the atmosphere and deep ..everything about this one was pure perfection..acting ..cinemagraphy..story telling ..performance..it was like watching Live documentary...,True
@EastFame,2024-04-17T15:10:42Z,0,someone forgot to color the Log footage,True
@darbyheavey406,2024-04-17T14:28:23Z,1,Apply this to the Transgender Industrial Complex…follow the money.,True
@user-js2sv1pw2e,2024-04-17T07:14:13Z,2,"As a child, I was scared of ghosts and zombies, but as I grew older, I realized that the scariest things are humans.",True
@yodamaster,2024-04-16T06:18:41Z,0,The trailer doesn't give me any idea about the movie.,True
@mrstifler8987,2024-04-16T01:45:53Z,1,I literally tried to watch this. Soo bland and boring. Especially after watching the better versions of this type of movie. I found myself 👀 my at my phone and just dazing off. Don’t let these bot comments fool you. No plot. No action. Fucking terrible,True
@pretzelandmustard,2024-04-15T21:39:08Z,0,"A superb interpretation of the banality of evil, and the environments we create to not only perpetrate evil, but to hide ourselves from it.",True
@Pilkie101,2024-04-15T10:01:30Z,1,I personally find it very brave that somebody finally tackled this subject through the medium of film.,True
@WildImgination,2024-04-15T09:46:25Z,1,Like Israelis,True
@uffu2490,2024-04-15T02:02:59Z,0,Currently watching this and it’s horrifying. The fact that the director portrays Höss in a normal manner should frighten everyone.,True
@Robert-vw3od,2024-04-14T21:45:47Z,1,Glazer is one of the very best British creators . Everything has a message. Everything is about humanity.,True
@beazjohnson9865,2024-04-14T10:25:40Z,1,That last song is still giving me nightmares,True
@AshKetchumfromPalletTown,2024-04-14T00:55:37Z,1,Song?,True
@Nopeeeeee24,2024-04-14T00:31:41Z,1,How did Germans casually live life outside when it smelled like death everywhere in the air….,True
@dudoklasovity2093,2024-04-13T19:21:22Z,1,Family with just a normal life…..but not really…,True
@garrettj6838,2024-04-13T19:08:38Z,1,Had to prepare myself for this one. Literally felt out of breath watching this. The score was unbelievably powerful. Wow 🤯,True
@RAMartini,2024-04-13T13:07:59Z,0,Wow. A brilliant look into terrible humans that we are.,True
@louisefrance9967,2024-04-12T22:58:48Z,0,Looks like no zone of interest whatsoever!  Definitely give this one a miss,True
@caseherc5991,2024-04-12T03:39:46Z,3,"My opinion,  this movie 🎬 is flat, like flat soda, like eating cereal but the milk is warm and you just want to spit it out, kinda like opening a piece of gum and you start cholewing it just to find out its flavorless gum",True
@areyoutheregoditsmedave,2024-04-11T18:29:25Z,4,this is stock feed for midwits.,True
@LegendaryBrandon1,2024-04-09T16:34:30Z,2,"""AnOtHer WoKe MoVie""",True
@Vulkurt,2024-04-09T13:06:39Z,0,"I have been waiting for information about the Blu-ray or 4K release of this film, but there has been no news.  Can someone please update when a physical copy will be available?  Thank you.",True
@LazerbeamW,2024-04-09T05:28:33Z,4,This was the most boring movie I ever did watch,True
@omahadadbod,2024-04-08T16:05:27Z,0,"If I had to give my honest opinion about The Zone of Interest, I'd have to say that I actually liked it. This might come as a surprise to some, considering my usual disdain for ... pretty much everything. But there was something about this film that resonated with me on a deeper level. The raw, unfiltered portrayal of such dark subject matter is refreshing in a sea of sanitized Hollywood. Overall, it's a thought-provoking and moving piece of cinema that stays with you long after the credits roll. It's not an easy watch, but it's an important one.",True
@fairuzmaileen5691,2024-04-08T12:45:10Z,0,"Just watched it... was interesting. The visuals where everything is understood without explanations or verbal narrative was really good.  Never was made a movie through this perspective and it makes it original. The way how a ""boss""  from millitia would speak of people, like ""casualties"", using codes and all that is something happening in all wars, and it gives a brief comprehension on how you need disassociation from reality in order to accomplish the most cruel orders against strangers, dehumanized in every way... movie even had an unexpectedly funny scene almost at the end😂",True
@solsol7428,2024-04-08T06:19:07Z,2,Malísima.esta película,True
@TheFoxFromSplashMountain,2024-04-08T05:16:35Z,2,"Seeing a family living a normal life, children playing, having birthday parties etc. while one of the most horrific atrocities in history was happening just a few feet away really put into perspective how normalized the Holocaust and the hatred of Jews was at the time. Terrifying.",True
@uterauch3433,2024-04-07T18:32:02Z,0,"Complicity of humans...oh NO .
Only animals behaviour...of these alienated  beings.😮😢😮😢",True
@omargutierrez9521,2024-04-07T16:32:11Z,7,Free Palestine,True
@santiagoalberomartinez3995,2024-04-07T13:31:52Z,0,Buena película JUDIA,True
@aysutalks8216,2024-04-07T09:03:36Z,1,"A contemporary film ,,lets talk anout that",True
@Evil_Pixl,2024-04-07T05:16:33Z,1,One of the best movies I've seen.,True
@ckok7792,2024-04-06T21:16:42Z,0,"I do not think I can watch this one, although it’s probably a great movie.  Working with little children at my job and how I grew to love them and these monsters who did terrible things to them.  Their own children to boot.  Absolutely awful.",True
@thenobullshtchannel8768,2024-04-06T01:50:41Z,1,Zieg!  ☠️,True
@Xixbalba,2024-04-06T01:29:06Z,2,Just watched this film. This is the most uneasy I’ve felt in a long time…,True
@ONLYGOODleftistisaDEADleftist,2024-04-05T23:52:52Z,1,Perhaps we could adopt this solution for leftists in America?,True
@fasthracing,2024-04-05T09:43:42Z,0,"Watched it last night. Along with Downfall, Saving Private Ryan possibly the best film about WW2. IMO",True
@user-cb9je6oj7u,2024-04-05T02:54:20Z,0,"And as it is appointed unto men once to die, but after this the judgment: (Heb 9:27)
For the love of money is the root of all evil: which while some coveted after, they have erred from the faith, and pierced themselves through with many sorrows. (1 Timothy 6:10)
And whosoever was not found written in the book of life was cast into the lake of fire. (Revelation 20:15)
For what shall it profit a man, if he shall gain the whole world, and lose his own soul? (Mark 8:36)",True
@n.stiller146,2024-04-04T18:56:24Z,2,"Save yourself some money nothing ,I mean nothing happens in this movie besides seeing his wife and kids in the house or pool ..end of story...it was so disappointing.",True
@anonyym5050,2024-04-04T12:10:34Z,2,Saw this movie yesterday and it was super boring. There are many other better Nazi movies. I can understand that they didn't want to show bloody scenes and the jews etc. but you could create such good pictures with the contrast of the house and the camp and also some nice sounds / music score etc. It not really interesting. Sorry.,True
@WhatsInAName718,2024-04-03T20:09:53Z,4,"Is it just me, or was this the most pointless movie you've ever watched? I don't get it... nothing happens. It's just a boring family, a dude with an ungrateful bitch of a wife who wants to go to a spa, so he decides to let some other girl suck his dick (I assume, as we don't even see THAT much), and then he gets transferred, throws up a bit and then ends. 

The final scene showing the shoes of those lost on display showed the scale of the holocaust, but that could have been the front cover of the movie and not bothered with the motion picture. The only reason this movie has 7/10 on IMDB is because it would be offensive to give it the 1/10 it deserves due to it's nature and would result in the critics and any affiliates being cancelled. 

I think this movie is as bad as the events it tried to depict.",True
@ximboximbo,2024-04-03T19:58:05Z,0,Katastrophe,True
@angieelzalaf6819,2024-04-03T13:52:09Z,4,I absolutely hated this movie.,True
@user-yr8ui7oy9h,2024-04-03T10:34:25Z,1,Endlich wieder ein guter Nazifilm aus Deutschland.😏,True
@TommyLikeTom,2024-04-02T09:31:24Z,2,"I just watched this film and while it is interesting nothing actually happens in it, and the result is kind of a nothing-burger",True
@TommyLikeTom,2024-04-02T05:18:09Z,3,This film is about Israel,True
@obergrupenfuhrer2359,2024-04-01T13:33:33Z,9,"OMG a white family!!! So scary!!! And they are German too!?! Can it get any scarier??? I was just beginning to forget how bad the holocaust was, but thanks to this movie made by a Jewish person I now remember how horrible the holocaust and white people are!!!",True
@stevensmith-rb9if,2024-04-01T12:59:33Z,3,boring,True
@Jhay7031,2024-03-31T23:49:46Z,2,More like the Zone of Boredom,True
@MarkusJunginger-sy4zx,2024-03-31T19:29:40Z,0,"Jonathan Glazer möchte die Normalität einer deutschen Nazi-Familie zeigen - warum zeigt er sie nicht??? Jonathan Glazer zeigt lediglich ein Familien-Idyll, als hätte er sich über deutsche Familien im dritten Reich anhand von Filmen des Goebbelschen Propaganda-Ministeriums informiert. Wo ist die deutsche Zucht? Wo ist die deutsche Erziehung zum Kadaver-Gehorsam? Wo ist die deutsche Erziehung zu Unter- und Überordnung zu sehen? Wo ist die Darstellung der 'Wer sein Kind liebt spart mit der Rute nicht'-Erziehung? Wir wissen was unmenschliches hinter der Mauer geschah, die die Familie Höß vom KZ Auschwitz trennt, das haben wir ausführlich im Geschichte- Unterricht gelernt, aber was wissen wir noch davon wie Unmenschlichkeit den Kindern und Jugendlichen eingebläut wurde? Wie ihnen blinder Gehorsam beigebracht wurde? Wie wurde deutschen Kindern ein absolutes Rangordnungsdenken vermittelt, das aus Deutschen Übermenschen und aus Juden Ungeziefer machte? Jonathan Glazer will die Realität zeigen, warum tut er es nicht?",True
@user-cv8uw7ph9w,2024-03-31T12:35:24Z,2,Wow. First time I’ve been really interested in a movie and after watching the trailer lose all that interest. Good job. 👍🏼,True
@teknoli1145,2024-03-30T21:16:43Z,1,"I just sah the movie, it's really different. Many places with hardly any sound and a great mix of pure video and pure sound. A great ending gives the film a great massage. I would recommend you watch it, even if some parts are quite unconventional, it gets better and better when it goes on.",True
@hind812,2024-03-30T11:37:07Z,1,"Best movie of the year, amazing work of art",True
@angelnieto316,2024-03-29T22:46:34Z,2,I’m a hour in and I must say this is one of the most boring fucking movies I ever seen. I love dialogue more than action but the first hour has been fucking pointless! I almost want to turn it off but I already made it this far might as well finish!,True
@TMTM584,2024-03-29T22:11:06Z,1,"Unbelievable that the jews are doing the same thing in Gaza today. Shame on you! Never forget, but we can do it.",True
@kazm1839,2024-03-29T15:05:23Z,3,Nazis are like israel soldier in Gaza,True
@COYS23,2024-03-29T10:57:31Z,0,Glad I won't be watching this 😂,True
@zillsburyy1,2024-03-29T02:17:33Z,2,looks like kubrick directed,True
@andrewjackson3486,2024-03-29T00:48:14Z,0,Wow another movie about evil Nazis super compelling....,True
@Pitchoune-dl2lp,2024-03-28T19:08:05Z,0,"I've never felt uncomfortable in front of a film. It's so disturbing. Evil becomes commonplace, and every scene shows how each person is affected by the horror unfolding next door.",True
@user-de7lg9yn2f,2024-03-28T02:21:31Z,3,very boring trailer,True
@ananthajay3048,2024-03-27T12:19:05Z,1,after watching this i am just numb and impressed,True
@AdamNakonieczny-ns9po,2024-03-27T08:36:13Z,0,what a trailer!,True
@user-kt6fp8me6h,2024-03-27T04:08:00Z,1,This movie was f'd up...very effective.,True
@lordoftravel7969,2024-03-26T19:11:48Z,1,"I just took a sh*t that is still flowing. That's art and the fact that you're disgusted only proves it. The most overrated garbage ever about literally nothing. Can't even compare with Society of the Snow on any level. Oh and I loved Schindler's List, The Pianist and everything else about the holocaust released before, even been to Auschwitz 3 times but this is so boring I'd rather watch paint dry. And I get the sound, smell, banality of evil and all that but give me 10% of that money and I'll make you 100 times better movie. I used to watch Oscars to know what to watch but the last 9 years I only check the results the next day to know what not to watch. I wish I had known this was gonna win before I  watched it and struggled to stay awake after 2 energy drinks. F*ck Glazer. Never gonna see anything from that ""modern artist"" ever again. I'd rather go to Tate Modern to watch somebody take a sh*t on the middle of the room.",True
@bluefoxvenus,2024-03-26T13:25:22Z,0,I do not understand why people find this film sort of unsettling. It is a realistic representation of the German and western mindset that exists even today.,True
@scoobydont8352,2024-03-26T06:19:22Z,3,"I didn't expect it to be this boring, very disappointed",True
@communitysurplus17,2024-03-24T23:12:04Z,3,Worst trailer I have ever seen in my entire life,True
@imperatormouse2735,2024-03-24T20:13:24Z,4,"This movie is a waste of money, time and popcorn. Just watched it.",True
@kimj5037,2024-03-24T14:14:25Z,4,"I don't bother with the Oscars so I hadn't heard about this movie. But, after the backlash against Jonathan Glazer's Oscar speech, this movie is now on my must watch list.",True
@user-ip4td2ok4l,2024-03-24T05:45:28Z,1,How about a movie about the new port being built in Gaza with the rubble of blown up homes and bits of bones and body parts. Will you be making movies about the genocide of thousands of children in Palestine?  Yeah didn't think so.,True
@navein4648,2024-03-23T08:39:53Z,0,Can someone explain,True
@Crazysolokid,2024-03-23T01:59:41Z,0,ok so the boy in the stiped pajamas pretty much,True
@rakhemseku,2024-03-23T00:15:53Z,3,Sandra is on a roll.,True
@SamuelFernandes-go7pe,2024-03-22T19:44:25Z,1,This is what a trailer should look like,True
@Unbiter,2024-03-22T16:36:41Z,0,The fart sounds are a bit distasteful,True
@LooneyBinAdventures,2024-03-22T04:31:41Z,0,Not for me,True
@jay23cr,2024-03-21T11:36:24Z,1,GAZA,True
@PranayPatil.22.02,2024-03-21T07:48:54Z,0,ZONE OF INTREST WHITE DEATH LOTUS,True
@PranayPatil.22.02,2024-03-21T07:48:49Z,0,ZONE OF INTREST WHITE DEATH LOTUS,True
@PranayPatil.22.02,2024-03-21T07:48:44Z,0,ZONE OF INTREST WHITE DEATH LOTUS,True
@PranayPatil.22.02,2024-03-21T07:48:39Z,0,ZONE OF INTREST WHITE DEATH LOTUS,True
@PranayPatil.22.02,2024-03-21T07:48:33Z,0,ZONE OF INTREST WHITE DEATH LOTUS,True
@PranayPatil.22.02,2024-03-21T07:48:28Z,0,ZONE OF INTREST WHITE DEATH LOTUS,True
@PranayPatil.22.02,2024-03-21T07:48:23Z,0,ZONE OF INTREST WHITE DEATH LOTUS,True
@PranayPatil.22.02,2024-03-21T07:48:17Z,0,ZONE OF INTREST WHITE DEATH LOTUS,True
@PranayPatil.22.02,2024-03-21T07:48:13Z,0,ZONE OF INTREST WHITE DEATH LOTUS,True
@PranayPatil.22.02,2024-03-21T07:48:08Z,0,ZONE OF INTREST WHITE DEATH LOTUS,True
@PranayPatil.22.02,2024-03-21T07:48:03Z,0,ZONE OF INTREST WHITE DEATH LOTUS,True
@PranayPatil.22.02,2024-03-21T07:47:57Z,0,ZONE OF INTREST WHITE DEATH LOTUS,True
@PranayPatil.22.02,2024-03-21T07:47:51Z,0,ZONE OF INTREST WHITE DEATH LOTUS,True
@PranayPatil.22.02,2024-03-21T07:47:45Z,0,ZONE OF INTREST WHITE DEATH LOTUS,True
@PranayPatil.22.02,2024-03-21T07:47:38Z,0,ZONE OF INTREST WHITE DEATH LOTUS,True
@PranayPatil.22.02,2024-03-21T07:47:15Z,0,ZONE OF INTREST WHITE DEATH LOTUS,True
@PranayPatil.22.02,2024-03-21T07:47:01Z,0,ZONE OF INTREST WHITE DEATH,True
@PranayPatil.22.02,2024-03-21T07:46:54Z,0,ZONE OF INTREST WHITE DEATH,True
@Farceb,2024-03-21T04:19:10Z,0,"I found the sound tracks on google, hahha poor job by the engineer sound",True
@bartolomeestebanmurillo4459,2024-03-21T00:11:32Z,1,"Far more frightening and chilling than any horror movie. It portrays the Nazis as they truly were, not mustache twirling villains but everyday people like all of us.",True
@kristi.s9922,2024-03-20T22:31:09Z,75,"This is the movie that starts working on you when it's over. Two days later, common things in your life will turn into flashbacks and connections to this movie. And of course Sandra Hüller, sometimes the walk talks more than what people say.",True
@AJBell-dh6ry,2024-03-20T22:03:00Z,2,"The Germans were the good guys, and 80 years of lies doesn't change that.",True
@muhammaddhanish1562,2024-03-20T19:39:26Z,5,Like Palestine of today!,True
@lerenschrijven9339,2024-03-20T17:07:10Z,5,🇵🇸 Gaza perhaps is right now the zone..,True
@brianthomason5022,2024-03-20T16:42:53Z,2,If I had to guess I would bet that this is wicked boring,True
@8946d3,2024-03-20T12:58:58Z,0,"Who watched the movie, in which language is it?",True
@user96368,2024-03-20T09:55:28Z,2,"waste of time, art for hipsters... overhyped, borring nazzi shit",True
@samkachakech5719,2024-03-20T02:54:43Z,7,One day they’ll make a movie about Israeli people living a normal live perusing their dreams 2 miles away from where a Gen.cide taking place. Mark my words,True
@mstacymedia,2024-03-20T02:46:22Z,1,Wow this movie looks like it really sucks..,True
@racializedkanadian,2024-03-20T01:04:42Z,11,"I'd call this the MOST IMPORTANT film released in the 21st century so far.

Yes it's about dark time in our history, but it's also about RIGHT NOW.  

Completely relevant to the dangerous times we are currently in.",True
@herms6612,2024-03-19T21:25:20Z,1,Was für ein Dreck,True
@salRL-eb3zc,2024-03-19T17:10:40Z,1,Shame on you jonatan glazer.,True
@princesssiobhanfiona,2024-03-19T16:00:21Z,1,This trailer alone gives me such an eerie feeling. Will definitely have to see this film.,True
@user-sv7fd6es6s,2024-03-19T03:04:59Z,0,"This is a great movie, I loved it. I just hated that weird noise, sounded like a burp or something horrible.",True
@farhanaazmi4512,2024-03-19T02:27:15Z,14,"This is happening RIGHT NOW, Israel is committing genocide, occupation and ethnic Cleansing on Palestinians in Palestine since 1948, very much inspired by Nazis",True
@danigelis,2024-03-18T22:55:00Z,5,"You want another “examination of human complicity”, simply look at having a music festival celebrating “peace and love” right next door to the world’s largest open air concentration camp that is Gaza.",True
@jhayeanderson1000,2024-03-18T07:15:51Z,1,There's a lot of unnecessary/ not important scenes. If we will remove those insignificant scenes this will be a 30 minute movie.,True
@roydl8536,2024-03-18T06:05:16Z,3,How about making a movie about Israel abuses to Palestinian people?,True
@doyanmakan3001,2024-03-18T04:35:55Z,3,"The story, its happening. At this very moment. At Gaza",True
@frankiegoeshollywood5062,2024-03-17T20:37:24Z,3,"Yes, as you can see now that the Germans were normal people like us.",True
@CrimsonSurvival,2024-03-17T20:12:39Z,4,Looks like artistic garbage.,True
@dempseychannel1531,2024-03-17T15:40:57Z,1,This moive makes me sick,True
@dongusmalongus1915,2024-03-17T08:04:26Z,2,dead sick of nazisploitation.,True
@slinkyboo-boo,2024-03-17T04:34:54Z,3,Exactly   like living near a slaughterhouse. Everyone ignores the horrors.,True
@yorelativo5394,2024-03-17T04:28:34Z,8,this movie literally just give me a panic attack and I'm not easily impressed. it's the lack of actually watching the horror that make me feel bad. It feels like we are watching things from their evil perspective and it make me so sick. I hurt for all the innocent people who died i hurt with all my heart.,True
@mavious2010,2024-03-17T03:55:01Z,0,AWESOME,True
@SebastianOliverr,2024-03-17T03:29:19Z,46,I will watch it because of the director's beautiful speech about Gaza at the Oscars ✨ ❤ 🇵🇸,True
