author,updated_at,like_count,text,public
@steve19811,2023-10-21T06:29:44Z,0,"Living your best life and working on your own consciousness is the best you can do for others, no matter their situation.....   I'm not going to jump in and join some dumb war or social cause and 98% of you wouldn't either.....",True
@JustSomeAussie1,2023-10-21T05:43:20Z,0,I can't believe my eyes. An A24 release that's not in 4:3 aspect ratio,True
@darknightq1,2023-10-21T04:15:16Z,0,Menarik,True
@SuiGenerisPerspicacity,2023-10-21T02:54:48Z,0,more white hate smh,True
@jcc389,2023-10-21T01:14:21Z,0,the fart trailer,True
@thedreamisstilldead,2023-10-20T22:15:30Z,24,This is definitely the must-see film of 2023. Brilliant. I look forward to a physical media release.,True
@beardedbozo,2023-10-20T21:27:42Z,0,This feels almost Yanthimos adjacent somehow. Exciting!,True
@packedentertainment2866,2023-10-20T19:40:13Z,1,When’s the MaXXXine trailer coming?,True
@HArryvajonas,2023-10-20T19:02:33Z,2,"This looks to be about the Nazi scientist/ official who lived with his family right next to a concentration camp? I don't recall his name or actual position, but he managed the concentration camp by day then walked next door to live a 'normal'' life with his family.",True
@magicknight13,2023-10-20T17:54:07Z,5,"Oh my GOD I can't wait!!!! What a perfect trailer. Knowing his previous movies and seeing this intense peek, I can't wait to see this!",True
@thebacklogisreal,2023-10-20T15:25:45Z,1,My coworker saw this and said it was excellent.,True
@MrKylePopovich,2023-10-20T13:13:38Z,0,"I remember when I that the raw out of the camera looked good. BEFORE film school. When I had no time or money. Glazer, what happened? (Birth and Under the Skin fan here). I didnt even know this was you until I looked at the description.",True
@MarinaAndTheDevil,2023-10-20T13:08:22Z,1,Finally a new Jonathan Glazer film!!!!,True
@fadli_1577,2023-10-20T12:25:55Z,0,Looks good,True
@miggs80,2023-10-20T12:22:46Z,4,A trailer about nothing. Stoked.,True
@robbymorgan9951,2023-10-20T11:06:38Z,0,"I'm sure the movie will be great, but the soundtrack sounds like someone ripping ass, like it literally sounds like someone farting into a tuba. 

And I feel like I'm going crazy, I can't believe no-one else has said it.",True
@commandercaptain4664,2023-10-20T00:11:38Z,1,"_Critic Blurb: The Movie_

I’m just happy this trailer uses original music instead the usual dubtrap bullcrap.",True
@aleahsummerville3601,2023-10-19T22:32:32Z,2,Trailer made zero sense,True
@vibewhen,2023-10-19T22:14:03Z,0,This certainly put me in the Zone of interest.,True
@i.d.6492,2023-10-19T22:11:33Z,0,A24 my favorite studio for life,True
@t2themoon,2023-10-19T21:04:50Z,0,can't wait,True
@donvaeth4462,2023-10-19T20:32:02Z,0,Can't wait,True
@jmbrissett5545,2023-10-19T20:02:38Z,0,What is this movie about? This trailer tells me nothing.,True
@sylvestervoigt9836,2023-10-19T17:10:42Z,0,The well manicured Layout reminds Me of the scene in the Hunters Series  when the NaZi Guy goes on the Picnic Killing Rampage,True
@Emanuelmooraes,2023-10-19T15:33:50Z,4091,It's incredible how A24 saved contemporary cinema. Congratulations on making such authentic films prioritizing art,True
@LongDeathBlueNeck,2023-10-19T15:25:11Z,3,Woah. Looks incredible and doesn’t give away the whole story of the film. Imagine that.,True
@sanjairaj3532,2023-10-19T15:25:08Z,1,What is truly new is the color scheme used for a historical film,True
@prophecyrat2965,2023-10-19T15:20:20Z,0,Humans paying taxes for Warchines that will annhilate all life on Earth be Like:,True
@Vittosio,2023-10-19T15:02:23Z,0,The view and the uneasiness yet revealing of it looks so great,True
@bnbtoys,2023-10-19T14:36:53Z,0,💩,True
@SanFranDentist94301,2023-10-19T14:21:32Z,0,Guessing they stolean estate from a Jewish family,True
@Jon-yn4pq,2023-10-19T14:15:08Z,0,They're nazis right?,True
@FutureExitsMedia,2023-10-19T14:13:44Z,9,"Cut to 2023 and Israel continue their own extermination of another culture, having apparently learned zero lessons from their past. The historical irony is horrific.",True
@johnnyhorowitz6669,2023-10-19T14:10:34Z,1,a movie about Nazi Germany oh thats knew,True
@facundovignoli,2023-10-19T13:20:59Z,0,"This looks fucked up, i am thrilled!!",True
@blipblop9094,2023-10-19T13:08:39Z,0,"trailer full of farts, i'm in.",True
@Trolololyoulose,2023-10-19T12:33:20Z,6,"I've never been disappointed with jonathan. even with Birth being my least favorite it's filled with everything masterful. Sexy beast, Under the skin. Once he makes a movie it's special and new and has something to say. He's up there with the greats despite not much of a lengthy catalog. this is my most anticipated of the year",True
@eevee5982,2023-10-19T11:54:26Z,1,"Aw hell nah, when the trailer has little to no dialog, you know theyre gonna make you think",True
@nerd26373,2023-10-19T11:43:36Z,0,The Zone of Interest had me all excited for all the right reasons. This seems like straight out of anything related to a mystery novel in the process. I’m certain Sherlock Holmes will find something amiss (no sh*t Sherlock) or brutally dishonest or weirdly out of place in a situation like this. A24 is applaudable. They’ve done it again.,True
@Dirtblokje154,2023-10-19T11:41:21Z,0,backrooms trailer when,True
@deanstirling3775,2023-10-19T11:21:18Z,0,"So it's Boy in the Striped Pajamas, but from the father's perspective.",True
@hanshollenweger7709,2023-10-19T06:49:23Z,0,"Wow, SANDRA HÜLLER! 

If you haven't, watch ""Toni Erdmann"", Sandra Hüller is an amazing actress with a quiet intensity you don't find very much anymore.",True
@Epoch-vu8cj,2023-10-19T06:11:21Z,2,Like those who complied with the jab(s) that led to deletions and adverse injuries,True
@guitarcatlind6075,2023-10-19T05:56:07Z,1,What's with the fart sounds?,True
@Nightmare-Realm-Media,2023-10-19T02:36:10Z,4,I don’t get it,True
@Arany-Csillag,2023-10-19T00:39:28Z,0,Amazing. Cant wait to watch it whenever it comes out on whatever it comes out on someday maybe i guess,True
@user-xu5jn7qp9q,2023-10-18T23:57:36Z,1,The only thing that seems a little off here is that the trailer suggests Glazer is being cool and arty on such a devastating subject. He is cool and arty but there are also scenes in the actual film where it's clear he aknowledges this paradox and shines a humanistic light so bright you wont see anything. Literaly.,True
@malachickisawesome,2023-10-18T23:50:49Z,1,Yep,True
@user-lb8lk1jv9w,2023-10-18T23:28:37Z,0,So exiting for this movie!,True
@TheLegendaryMovieCritic,2023-10-18T23:27:46Z,0,The Zone Of Interest is gonna be full of suspense!,True
@kdizzle901,2023-10-18T22:35:13Z,0,Are we supposed to feel bad for this family?,True
@kjv2816-mr7qc,2023-10-18T20:25:59Z,0,"'Behold, the former things are come to pass, and new things do I declare: before they spring forth I tell you of them.   (Isaiah 42:9)
'Jesus saith unto him, I am the way, the truth, and the life: no man cometh unto the Father, but by me.   (John 14:6)
'But I am poor and sorrowful: let thy salvation, O God, set me up on high.   (Psalm 69:29)
'He hath made every thing beautiful in his time: also he hath set the world in their heart, so that no man can find out the work that God maketh from the beginning to the end.   (Ecclesiastes 3:11)
'Who will have all men to be saved, and to come unto the knowledge of the truth. For there is one God, and one mediator between God and men, the man Christ Jesus; Who gave himself a ransom for all, to be testified in due time.   (1 Timothy 2:4-6)
'But if ye be led of the Spirit, ye are not under the law.   (Galatians 5:18)
'And God hath both raised up the Lord, and will also raise up us by his own power.   (1 Corinthians 6:14)",True
@adrianstjarnfaldt9895,2023-10-18T19:46:38Z,0,This one really didnt do it for me there was just too manny bad plot holes amd tore the story apart and several bad camera work,True
@thevileone91,2023-10-18T17:14:39Z,0,If it's coming from A24 you Know I'm watching that bihhh!! I ain't NEVER GONNA STOP WATCHING A24 FILMS!! (If y'all don't know a William Montgomery impersonation when you see one you gotta catch up),True
@Mad1Lee,2023-10-18T16:35:16Z,3,"Based on the amazing book of Sir Martin Emis, incredible British writer who passed away not so long ago. I recommend everyone to read it and read his other works.",True
@matthewjury4385,2023-10-18T15:31:45Z,16,I love his films so much and this looks like yet another winner. It's so rare these days to be genuinely excited for a film.,True
@thebipman,2023-10-18T15:12:29Z,0,Terrible trailer 😂,True
@Gemnist98,2023-10-18T14:56:39Z,32,"In literally every single shot featuring the sky in this trailer, there is smoke. That is absolutely terrifying.",True
@introvert__music,2023-10-18T14:11:39Z,0,very exciteddddd,True
@petyavodolaz,2023-10-18T13:54:05Z,0,Glazer kino,True
@jeeefthegreat7555,2023-10-18T13:30:15Z,0,FYI:  We don't believe mainstream publications anymore.  So their reviews ... might as well stop paying them to write those for you.,True
@user-pt5qn8ro6d,2023-10-18T13:29:07Z,1,Finally!!!,True
@ANDROLOMA,2023-10-18T13:14:09Z,0,I got so disinterested in this zone of interest. Most banal trailer ever.,True
@rgpaiva5409,2023-10-18T12:47:19Z,0,I would def subscribe to a A24 streaming.,True
@thekingofdale990,2023-10-18T12:38:29Z,1,fart,True
@Koodafoop,2023-10-18T12:29:27Z,0,looks weird. (adds to watchlist),True
@marshwalker8322,2023-10-18T10:57:45Z,0,Is this set on a concentration camp?,True
@75zy,2023-10-18T10:56:07Z,2,Another slow burn movie to watch but with good cinematography,True
@DARKCITYENT23,2023-10-18T10:23:33Z,4,Looks boring As fuhhhh already,True
@mars2803,2023-10-18T09:51:54Z,4,I've never been more excited for a film.,True
@theholymackerel072,2023-10-18T09:32:27Z,1,"It’s about Rudolph Hoss, who murdered over a million people in Auschwitz.",True
@Lenny.262,2023-10-18T09:23:50Z,0,"People without a conscience usually have a better time than people who do have one. You see it all of the time. People leading seemingly perfect lives with a seemingly perfect family and beautiful homes and they're actually horrible people. More often than not, it all turns out to be a facade that they've worked really hard to build up to conceal who they truly are.",True
@PacTheOne,2023-10-18T09:13:57Z,0,+1 for trailer not showing anything but wanting me more. Take note big corps that dont let the director do the trailer (Yes the stakeholders do that normaly to generate a maximum hype with maximum spoilery),True
@amineyassa2928,2023-10-18T08:34:05Z,1,"Another SS story , well always ready for Hitlers friends.",True
@latenightlogic,2023-10-18T07:29:31Z,6,"I’m all for a trailer not giving much away but this gave literally nothing away. All I have to go on is the words on screen, the comments and knowing the director. Maybe after I’ve seen it I’ll come back and say ‘ah yep, I see what you mean’.",True
@Alesae132,2023-10-18T07:01:34Z,1,I knew what this film was going to be about just by the trailer alone. It wasn’t even subtle. Then I read the IMDB synopsis and it validated my assumptions.,True
@Ghastly6890,2023-10-18T06:53:06Z,2,From the twisted mind of Jordan Peele: White People Being Normal and Happy,True
@GlennTillema,2023-10-18T06:35:12Z,1,"@0:52 ... those are teeth, aren't they? Incredibly creepy ...",True
@risingtide_official,2023-10-18T06:31:29Z,2,first half of the trailer looked like a Peter greenway movie..  then it got narrative.,True
@Inzpyred,2023-10-18T05:59:50Z,27,I love A24 trailers because they don't give away the whole movie. Half the time you don't even know what the movie is about after watching one of their trailers. Love it,True
@NoOne-tg9tk,2023-10-18T05:33:51Z,1,Critics Throw Masterpiece so easily,True
@philletoutpuissant,2023-10-18T05:29:32Z,2,Dogtooth Vibe,True
@eirianrobotto,2023-10-18T05:28:45Z,0,Looks disturbing. I luv traukers,True
@ricardoeugenecampher2248,2023-10-18T05:25:18Z,6,Right next door........literally right next to them,True
@hipsterelephant2660,2023-10-18T04:53:35Z,1,The guy who directed this did the music video for Virtual Insanity.,True
@lazerNeo,2023-10-18T04:16:03Z,253,Something really eerie that I already like about this is that almost every shot of this trailer makes me feel like a voyeur watching them from hidden cameras.,True
@skull16cr,2023-10-18T03:42:21Z,1,This is how you make a trailer,True
@tristn.hndrwn3880,2023-10-18T03:25:11Z,0,soo... this movie doesnt have dialogue? only like what uhh fart noises?,True
@shellghost,2023-10-18T03:05:21Z,0,These people at A24 are on fiyaaaa!! 🔥 they’re announcing a shit load of interesting films all at once!!,True
@PG-wz7by,2023-10-18T02:21:44Z,7,"I've waited a few years for this film. Glazer's films, sadly few and far between, are fantastic. Tomorrow we're seeing Under the Skin as part of a24's Thrills and Chills. Definitely big screen worthy, and I hope Zone of Interest plays near me.",True
@Tyler-hb6nq,2023-10-18T02:01:08Z,1,"That's how you do a teaser trailer. Shit, now I need to go watch ""Under the Skin"" and ""Sexy Beast"" again.",True
@collier6794,2023-10-18T02:00:28Z,2,"Anything A24 does is gold 
Keeping true cinema alive",True
@mon6745,2023-10-18T01:30:53Z,0,Ahh colonialism in film.  They forgot entitled,True
@fruit4evr,2023-10-18T01:27:27Z,1,"I know nothing about this movie but from the trailer alone I’m guessing it’s about a man who’s higher up in the Nazi Party and set during WW2/Holocaust?

Can anyone tell me if i’m wrong?",True
@Benjamin_Bratten,2023-10-18T01:21:28Z,5,"Very excited for this, but disappointed to learn the original writer is a notorious racist and Islamophobe who advocated for the ethnic cleansing we're seeing today.",True
@IHJello,2023-10-18T01:20:32Z,0,Been waiting all year,True
@samcookss,2023-10-18T01:17:09Z,1,"why are trailers not more like this, i literally no nothing about it but still want to see it",True
@victor_the_red,2023-10-18T01:09:44Z,2,More holocaust porn. When will they give it up?,True
@fiarandompenaltygeneratorm5044,2023-10-18T01:00:09Z,1,Jonathan Glazer is one of the world's best filmmakers. I'm here for it.,True
@grayscale31,2023-10-18T00:59:14Z,0,Feels like shot on iphone15 for some reason.,True
@3girlrhumba,2023-10-18T00:58:30Z,1,thanks for adding farting noises!! a24 youve done it again (it = annoyed me),True
@keatonkitsune4064,2023-10-18T00:57:02Z,1,"Haven't seen the movie or looked anything up on it. But I can see it's about WW2, the people we see are Germans/SS right next to a concentration camp.",True
@360.Tapestry,2023-10-18T00:47:11Z,0,"oh, yeah.... that's so them. it would never be us. we're better than that. that's how we are most like them",True
@christianthomas318,2023-10-18T00:34:14Z,1,I don't know about the movie itself but this trailer is giving me Kubrick vibes,True
@jaredf6205,2023-10-18T00:24:52Z,0,Those weird sounds in the trailer are going to be the next BWAMP trailer sound,True
@Swordfry,2023-10-18T00:18:24Z,0,Soooo.....wtf is this about???,True
@samanthal133,2023-10-18T00:13:14Z,0,I have seen a massive amount of WW2 films & this one looks bone chilling.,True
@ahabgaddis7277,2023-10-18T00:05:24Z,0,yawn,True
@LukeJamesActor,2023-10-18T00:01:53Z,0,"A24, the saviour of movies.",True
@zooropa5722,2023-10-18T00:01:23Z,2,"Another ""white people bad"" film? Or is it gonna be deeper than the other 2020s political commentaries? I hope so.",True
@truebloodtheband,2023-10-17T23:57:36Z,1,you had me at A24,True
@ThomasKent963,2023-10-17T23:54:31Z,1,"I weary of Nazi's... no longer South Afrika... I want to see entitled Israelis' as the entitled, and a very honest view of Palestinians.  I think it has been beyond long enough.",True
@collinjohnson9454,2023-10-17T23:50:46Z,1,"This is how to do a trailer.  No idea what it’s truly about, but there’s just enough to get under the skin",True
@splitsseconds9965,2023-10-17T23:46:51Z,8,All the Israelis living happy in tel Aviv right now,True
@quitpayload,2023-10-17T23:42:30Z,2,"At least in terms of cinematography and camerawork, this might be the closest I've ever seen a film to emulating the style of Stanley Kubrick",True
@sammavacaist,2023-10-17T23:39:55Z,6,This film isn't just about the Holocaust of course. Its about how we go about our comfortable lives and ignore all kinds of human suffering.,True
@Narrate918,2023-10-17T23:39:22Z,30,Been looking forward to this. Glazer is a genius. He doesn’t make many films but when he does it feels important.,True
@FullInstall,2023-10-17T23:37:32Z,1,That's Morning Calm from the Silent Hill 2 soundtrack,True
@BluePrada,2023-10-17T23:37:17Z,0,Sounds like a certain political party in the U.S. :),True
@HeroKeto,2023-10-17T23:36:19Z,1,Looks like mix of A Tale of Two Sisters and Parasite,True
@ShutUpCatProductions,2023-10-17T23:31:32Z,0,I was waiting for the title of the movie to be            “Little Tortilla Boy” (if you know you know),True
@johnquintmatt1986,2023-10-17T23:30:15Z,0,"THIS is the type of movie becoming of A24. Not this other ""feel good"" comedy crap type of movie.",True
@shenkaed,2023-10-17T23:28:53Z,0,"Gutted I couldn't' make this at LFF, had an emergency and didn't make the screening. Will definitely be booking tickets when it is oficialy released in UK.",True
@BP.COOPER,2023-10-17T23:25:03Z,0,TRAILER GIVES AWAY THE WHOLE FREAKIN MOVIE!!!   jk i'm glad this was so mysterious makes me want to see it more.  other distribution companies please take note; this is how you peak interest and don't spoil movies,True
@DemonWarp65,2023-10-17T23:19:39Z,0,"Oh boy. This is going to be hard to watch. I can already tell. I'm not saying it's going to be a bad movie, far from it, I am just saying that this will not be an easy movie to watch, nor should it be.",True
@maxpatrickhaynes2194,2023-10-17T23:16:53Z,0,"I somehow missed that it was a Glazer film!! Glad someone mentioned that!! He did Under the Skin, right?? That movie was fucking great!!!",True
@luizfernandoparralourenco2876,2023-10-17T23:08:03Z,1,"this is so necessary right now, can't wait",True
@ihateallthethings2683,2023-10-17T23:06:58Z,0,Love the alien fart sounds as the scenes changed,True
@GareBare90,2023-10-17T23:06:33Z,0,"In Glazer, I trust!",True
@DJ-wl5qo,2023-10-17T23:05:02Z,0,Ngl when I heard what this was about and how they depicted it I thought it was easily gonna win the Palme D’or because holy shit.,True
@prodbyvessel4318,2023-10-17T23:03:03Z,1,"Babe wake up, new A24 movie is coming",True
@EdenMisc.,2023-10-17T22:58:59Z,0,The older I grow the less patience I have with abstraction. Like wtf is this trailer? I still know nothing about this film. Thats not a good thing. It defeats the purpose of a trailer.,True
@lordello,2023-10-17T22:58:11Z,0,"people are so sorry and pity about the jews, but Palestinians not. 🤦‍♂

bad timing",True
@jimmymeridian5174,2023-10-17T22:57:30Z,1,"As soon as I saw those teeth, I just knew.",True
@michaelakinlabi7256,2023-10-17T22:54:05Z,0,Now that's a trailer.,True
@jonathanhlusic,2023-10-17T22:53:32Z,0,Just caught this at BFI the sound design is insane,True
@natannoel5974,2023-10-17T22:52:55Z,1,"Hmmm interesting, l can't no wait for this!",True
@haikai7088,2023-10-17T22:50:44Z,0,This is reminding me of Dogtooth,True
@worldofjessy,2023-10-17T22:50:31Z,0,dogtooth x midsummer vibes,True
@timthompson9246,2023-10-17T22:48:57Z,0,"I love Jonathan Glazer but this trailer sucks! All the damn quotes, so annoying to watch. A24 usually has great trailers, this one missed the mark. If I didn't know this was Glazer's film I wouldn't bother.",True
@jadenthomas1169,2023-10-17T22:48:18Z,0,This trailer makes my dog bark and run around in circles.,True
@gogigaga1677,2023-10-17T22:43:58Z,0,MOVIE OF THE YEAR,True
@feloniousfilms,2023-10-17T22:37:01Z,0,"I loved ""Under The Skin"". A film about Rudolf Hoss sounds... intense.",True
@toddpinkstonisgod,2023-10-17T22:33:07Z,0,In Glazer I trust. Under the Skin remains my favorite film to be distributed by A24. Looking forward to this.,True
@devisonpereira8692,2023-10-17T22:15:29Z,0,Até que fim!!!! Ancioso,True
@ericjamesphotography,2023-10-17T22:15:03Z,0,Oh it’s so edgy and artsy!!!!! I can’t wait! Lol😂lol😂lol😂,True
@anacruz2077,2023-10-17T22:13:39Z,0,finally got the trailer after waiting for months 😫,True
@make725daily1,2023-10-17T22:12:57Z,1,"I can't believe I found this hidden gem! Subscribed, and I'm excited for more wisdom! -- ""Achievement thrives on unwavering dedication and relentless effort..""",True
@backwoodsfilms875,2023-10-17T22:02:47Z,2,Kubrick vibes,True
@tmanley1985,2023-10-17T21:47:44Z,0,I don't know what this is about and I love that.,True
@loudermusic,2023-10-17T21:40:35Z,0,"you did it again guys, im in.",True
@TalonsOfFire,2023-10-17T21:34:38Z,0,"That's a very A24 soundtrack I hear, looks like it'll be excellent.",True
@SeemaSharma-ub5zl,2023-10-17T21:22:26Z,0,Can you help me.....???,True
@ModernSlackers,2023-10-17T21:16:52Z,0,Most stupid trailer from A24. I almost threw up.,True
@janechoy2073,2023-10-17T21:16:26Z,0,I hope this movie actually does release in Canada. I cannot find a release date at all,True
@MarkoGh,2023-10-17T21:15:20Z,2,"this is the 3rd major movie about Nazis that is coming out soon, it funny how they are all announced right when Isreal is invading Gaza, almost like they are trying to make us sympathize with Jews, now why would they want that hmmmm.... whats gonna happen in Gaza i wonder",True
@tbwatch88,2023-10-17T21:13:12Z,0,"well I wonder if the master, Martin Amis, got to see it before he died.",True
@cartmancaido2187,2023-10-17T20:39:00Z,0,mto bonitooo tendi nadaaa,True
@Louis-lb1ig,2023-10-17T20:35:24Z,1,Depressed Wes Anderson be like:,True
@brettsinger9565,2023-10-17T20:30:40Z,0,Looks disquieting and powerful. Can't wait!,True
@suddi09,2023-10-17T20:14:50Z,0,Anyone read the book?,True
@frankmango1888,2023-10-17T20:14:45Z,0,Unless it ends with the nazi family getting strung up from a tree I have no interest in movies that try to humanize them.,True
@George_Nakhle,2023-10-17T20:13:28Z,0,Really hoping the academy acknowledges this. There has never been a movie like it before,True
@itsnlee,2023-10-17T20:06:51Z,0,Very intrigued and unsettled by this.,True
@christianolson,2023-10-17T20:05:22Z,18,"One of, in not THE most underrated auteurs in cinema today. I would watch truly anything Glazer directs. I hope a longer trailer is coming. Thank you A24 for continually working with brilliant directors.",True
@TheWhiteWolf_bf2lm1,2023-10-17T19:48:24Z,0,A24's streaming? It seriously needs it!,True
@k-dramagoodmorningseoul,2023-10-17T19:46:16Z,4,"Hello, 

it's Wednesday again this week. 
It's a typical autumn day in Korea/Seoul. 
I wish you good health and good things for the rest of the week. 

And always cheering for your beautiful/fascinating activities. ^^",True
@moviemazlow,2023-10-17T19:42:28Z,0,"Missed it at Cannes this year, there was so much buzz about this movie.",True
@ignacylachowicz1362,2023-10-17T19:33:55Z,1,They will name it as the best movie of the decade.,True
@trejames8397,2023-10-17T19:32:49Z,0,Most boring film trailer I've ever seen. Zero interest to see this 👏 bravo,True
@cheistopher7829,2023-10-17T19:32:11Z,0,"How does the trailer feel as errie, evil, and horrifying as the subject matter/film!!?! I can't wait, sad I missed it at TIFF",True
@danielf986,2023-10-17T19:22:09Z,0,A24 is a juggernaut. Amazing trailer!,True
@digitaldina,2023-10-17T19:22:06Z,0,"this movie is how I feel like a lot of americans be living through what's happening in Phalesteen rn. 

500 martyred in a day after they obliterated the hospital. full of volunteer doctors, elderly, children. horrifying.",True
@jamespace1269,2023-10-17T19:16:20Z,1,why always the holocaust and not any film on athiest Lenin/Stalin killing hundreds of millions?,True
@videoinsomnia,2023-10-17T19:14:30Z,0,The dad's a nazi or something right?,True
@ravidoubleday2199,2023-10-17T19:12:24Z,0,best film of the year,True
@sidbakshi,2023-10-17T19:11:13Z,1,Watched it at NYFF...   Definitely in Top 5 for this year!,True
@SOYIVANMEN,2023-10-17T19:11:07Z,0,White people doing rural stuff always looks creepy,True
@NabilElJaouhari,2023-10-17T19:09:56Z,0,"Milk it, keep on milking it....",True
@Louise-wk5yf,2023-10-17T19:07:51Z,0,All the reviews of this movie are so intriguing. And I loved Under the Skin.,True
@tricerastops111,2023-10-17T19:07:32Z,0,"Don't schedule anything for after this movie.  Not drinks to talk it over with friends, not anything.  It's a movie that requires a stunned re-adjustment period afterwards.  It's genius and essential, but it's a gut punch.",True
@que_93,2023-10-17T19:07:27Z,0,"Could a trailer be any more intriguing than this!? All the secrets well hidden-- with just some streaks to hone the interest and prepare, to some extent, of what is to come...",True
@Adriansyah777,2023-10-17T19:03:23Z,0,*A24* 😎 its gonna be 🔥,True
@gdhuertas07,2023-10-17T19:02:35Z,14,"I like how this trailer makes it look like a horror flick. Which, in a way, it is.",True
@Riptide09,2023-10-17T18:58:27Z,0,I think this is about to go BOOM,True
@thiagodude,2023-10-17T18:56:13Z,0,Here comes the master with another masterpiece!,True
@H4ElGi,2023-10-17T18:52:07Z,0,"man, I love a42, but is there someone else who hates these stupid ass describtions by different journals inserted into the trailer? let me watch the film first and only then decide whether it's masterpiece, a brilliant holy work of the year or not. oh gosh. am i alone about this?",True
@__Jack_,2023-10-17T18:47:34Z,0,Another masterpiece coming.,True
